[
  {
    "id": "event-0001",
    "date": "1995",
    "date_certainty": "exact",
    "description": "13 Harrison Street converted into a two-unit condominium under Declaration and Offering Plan",
    "event_type": "filing",
    "proceeding_id": null,
    "related_claim_ids": [],
    "related_evidence_ids": [],
    "related_entity_ids": [
      "entity-0003"
    ],
    "causal_tags": [],
    "notes_internal": null
  },
  {
    "id": "event-0002",
    "date": "late 1990s",
    "date_certainty": "approximate",
    "description": "Upper unit (Unit 2) renovated by architect Annabelle Selldorf",
    "event_type": "modification",
    "proceeding_id": null,
    "related_claim_ids": [],
    "related_evidence_ids": [],
    "related_entity_ids": [
      "entity-0012",
      "entity-0130"
    ],
    "causal_tags": [],
    "notes_internal": null
  },
  {
    "id": "event-0003",
    "date": "2005",
    "date_certainty": "exact",
    "description": "Gwyneth Paltrow and Chris Martin purchased Unit 2 using entity Orchard House LLC",
    "event_type": "transaction",
    "proceeding_id": null,
    "related_claim_ids": [],
    "related_evidence_ids": [],
    "related_entity_ids": [
      "entity-0031",
      "entity-0053",
      "entity-0100",
      "entity-0130"
    ],
    "causal_tags": [],
    "notes_internal": null
  },
  {
    "id": "event-0004",
    "date": "2007 (some sources say 2009)",
    "date_certainty": "approximate",
    "description": "Paltrow and Martin sold Unit 2",
    "event_type": "transaction",
    "proceeding_id": null,
    "related_claim_ids": [],
    "related_evidence_ids": [],
    "related_entity_ids": [
      "entity-0130"
    ],
    "causal_tags": [],
    "notes_internal": null
  },
  {
    "id": "event-0005",
    "date": "early 2017",
    "date_certainty": "approximate",
    "description": "Both units at 13 Harrison Street offered for sale together",
    "event_type": "transaction",
    "proceeding_id": null,
    "related_claim_ids": [],
    "related_evidence_ids": [],
    "related_entity_ids": [
      "entity-0003"
    ],
    "causal_tags": [],
    "notes_internal": null
  },
  {
    "id": "event-0006",
    "date": "2014",
    "date_certainty": "exact",
    "description": "Taylor Swift purchased penthouse duplex at 155 Franklin Street from director Peter Jackson",
    "event_type": "transaction",
    "proceeding_id": null,
    "related_claim_ids": [],
    "related_evidence_ids": [],
    "related_entity_ids": [
      "entity-0103",
      "entity-0123"
    ],
    "causal_tags": [],
    "notes_internal": null
  },
  {
    "id": "event-0007",
    "date": "2017",
    "date_certainty": "exact",
    "description": "Taylor Swift purchased three-story townhouse at 153 Franklin Street",
    "event_type": "transaction",
    "proceeding_id": null,
    "related_claim_ids": [],
    "related_evidence_ids": [],
    "related_entity_ids": [
      "entity-0123"
    ],
    "causal_tags": [],
    "notes_internal": null
  },
  {
    "id": "event-0008",
    "date": "2018",
    "date_certainty": "exact",
    "description": "Taylor Swift purchased second-floor unit at 155 Franklin Street from financier Jeremy Phillips",
    "event_type": "transaction",
    "proceeding_id": null,
    "related_claim_ids": [],
    "related_evidence_ids": [],
    "related_entity_ids": [
      "entity-0060",
      "entity-0123"
    ],
    "causal_tags": [],
    "notes_internal": null
  },
  {
    "id": "event-0009",
    "date": "2008",
    "date_certainty": "exact",
    "description": "Morgan Brill purchased Unit 2 and undertook renovation",
    "event_type": "transaction",
    "proceeding_id": null,
    "related_claim_ids": [],
    "related_evidence_ids": [],
    "related_entity_ids": [
      "entity-0025",
      "entity-0090",
      "entity-0130"
    ],
    "causal_tags": [],
    "notes_internal": null
  },
  {
    "id": "event-0010",
    "date": "by 2007",
    "date_certainty": "approximate",
    "description": "Michael Edward Bleich and Alexis Bleich purchased Unit 1",
    "event_type": "transaction",
    "proceeding_id": null,
    "related_claim_ids": [],
    "related_evidence_ids": [],
    "related_entity_ids": [
      "entity-0010",
      "entity-0088",
      "entity-0128"
    ],
    "causal_tags": [],
    "notes_internal": null
  },
  {
    "id": "event-0011",
    "date": "fall of 2018",
    "date_certainty": "approximate",
    "description": "Sale of Unit 2",
    "event_type": "transaction",
    "proceeding_id": null,
    "related_claim_ids": [],
    "related_evidence_ids": [],
    "related_entity_ids": [
      "entity-0130"
    ],
    "causal_tags": [],
    "notes_internal": null
  },
  {
    "id": "event-0012",
    "date": "2023",
    "date_certainty": "exact",
    "description": "Steven Soderbergh purchased condo at 7 Harrison Street",
    "event_type": "transaction",
    "proceeding_id": null,
    "related_claim_ids": [],
    "related_evidence_ids": [],
    "related_entity_ids": [
      "entity-0122"
    ],
    "causal_tags": [],
    "notes_internal": null
  },
  {
    "id": "event-0013",
    "date": "2004",
    "date_certainty": "exact",
    "description": "Meryl Streep purchased penthouse at 92 Laight Street in River Lofts complex",
    "event_type": "transaction",
    "proceeding_id": null,
    "related_claim_ids": [],
    "related_evidence_ids": [],
    "related_entity_ids": [
      "entity-0086"
    ],
    "causal_tags": [],
    "notes_internal": null
  },
  {
    "id": "event-0014",
    "date": "August 24, 2018",
    "date_certainty": "approximate",
    "description": "Morgan Brill enters into a contract of sale with Towne 1031 Exchange for Unit 2 with closing date of October 18, 2018.",
    "event_type": "transaction",
    "proceeding_id": null,
    "related_claim_ids": [],
    "related_evidence_ids": [],
    "related_entity_ids": [
      "entity-0025",
      "entity-0090",
      "entity-0125",
      "entity-0130"
    ],
    "causal_tags": [],
    "notes_internal": null
  },
  {
    "id": "event-0015",
    "date": "March 2017",
    "date_certainty": "approximate",
    "description": "David Kornmeier lists Unit 1 at initial asking price.",
    "event_type": "filing",
    "proceeding_id": null,
    "related_claim_ids": [],
    "related_evidence_ids": [],
    "related_entity_ids": [
      "entity-0037",
      "entity-0075",
      "entity-0128"
    ],
    "causal_tags": [],
    "notes_internal": null
  },
  {
    "id": "event-0016",
    "date": "2017",
    "date_certainty": "exact",
    "description": "Unit 1 listing price raised to $6.5 million.",
    "event_type": "transaction",
    "proceeding_id": null,
    "related_claim_ids": [],
    "related_evidence_ids": [],
    "related_entity_ids": [
      "entity-0128"
    ],
    "causal_tags": [],
    "notes_internal": null
  },
  {
    "id": "event-0017",
    "date": "September 2018",
    "date_certainty": "approximate",
    "description": "Unit 1 listing price reduced to $5.5 million.",
    "event_type": "transaction",
    "proceeding_id": null,
    "related_claim_ids": [],
    "related_evidence_ids": [],
    "related_entity_ids": [
      "entity-0128"
    ],
    "causal_tags": [],
    "notes_internal": null
  },
  {
    "id": "event-0018",
    "date": "September 2018",
    "date_certainty": "approximate",
    "description": "Unit 1 listing price reduced to $4.75 million.",
    "event_type": "transaction",
    "proceeding_id": null,
    "related_claim_ids": [],
    "related_evidence_ids": [],
    "related_entity_ids": [
      "entity-0128"
    ],
    "causal_tags": [],
    "notes_internal": null
  },
  {
    "id": "event-0019",
    "date": "September 16, 2018",
    "date_certainty": "approximate",
    "description": "Unit 1 listing price reduced to $4.5 million under new Compass brokerage agreement.",
    "event_type": "transaction",
    "proceeding_id": null,
    "related_claim_ids": [],
    "related_evidence_ids": [],
    "related_entity_ids": [
      "entity-0035",
      "entity-0128"
    ],
    "causal_tags": [],
    "notes_internal": null
  },
  {
    "id": "event-0020",
    "date": "September 17, 2018",
    "date_certainty": "approximate",
    "description": "David Kornmeier delivers assessment that Unit 1 is 'half basement' with non-legal bedrooms; Bleich becomes angry, demands cancellation papers, and fires Kornmeier.",
    "event_type": "demand",
    "proceeding_id": null,
    "related_claim_ids": [],
    "related_evidence_ids": [],
    "related_entity_ids": [
      "entity-0037",
      "entity-0075",
      "entity-0128"
    ],
    "causal_tags": [],
    "notes_internal": null
  },
  {
    "id": "event-0021",
    "date": "October 15, 2018",
    "date_certainty": "approximate",
    "description": "Board of Managers meeting of 13 Harrison Street Condominium purportedly takes place with Morgan Brill and Michael Bleich recorded as present.",
    "event_type": "communication",
    "proceeding_id": null,
    "related_claim_ids": [
      "claim-0014",
      "claim-0019",
      "claim-0034",
      "claim-0064",
      "claim-0127",
      "claim-0287",
      "claim-0316",
      "claim-0317",
      "claim-0323"
    ],
    "related_evidence_ids": [
      "evidence-0006"
    ],
    "related_entity_ids": [
      "entity-0003",
      "entity-0004",
      "entity-0021",
      "entity-0025",
      "entity-0036",
      "entity-0087",
      "entity-0090"
    ],
    "causal_tags": [],
    "notes_internal": null
  },
  {
    "id": "event-0022",
    "date": "October 16, 2018",
    "date_certainty": "approximate",
    "description": "Bleich sends board meeting minutes to Brill and Bleichs under subject line 'Minutes.'",
    "event_type": "filing",
    "proceeding_id": null,
    "related_claim_ids": [],
    "related_evidence_ids": [],
    "related_entity_ids": [
      "entity-0025"
    ],
    "causal_tags": [],
    "notes_internal": null
  },
  {
    "id": "event-0023",
    "date": "October 17, 2018",
    "date_certainty": "approximate",